{
  "$schema": "../schemas/provider-connectivity-profiles.schema.json",
  "schema_version": "1.1.0",
  "inventory_id": "provider-connectivity-profiles-2026-09-26",
  "as_of": "2026-10-07",
  "purpose": "Record provider endpoints, model identifiers, credential environment-variable names, and sanitized connectivity/search probe outcomes. This is not a model-priority policy and does not enable production dispatch.",
  "credential_policy": {
    "secret_values_included": false,
    "credential_reference_format": "environment_variable_name_only"
  },
  "priority_policy_ref": "model-policy.template.json",
  "profiles": [
    {
      "profile_id": "mimo-token-plan-cn",
      "provider": "mimo",
      "service_tier": "token_plan",
      "endpoint": {
        "url": "https://token-plan-cn.xiaomimimo.com/v1/chat/completions",
        "protocol": "openai_chat_completions",
        "region": "China mainland"
      },
      "model": "mimo-v2.6-flash",
      "credential_env": "MIMO_PLAN_API_KEY",
      "capabilities": {
        "text_generation": "not_verified",
        "provider_web_search_documentation": "supported",
        "provider_web_search_probe": "failed_feature_gate",
        "function_tool_calling": "not_verified",
        "requires_external_search_runner": false,
        "stockqa_cli_e2e": "not_run"
      },
      "usage_note": "The user confirmed the web-search plugin was enabled, but this credential's probe returned webSearchEnabled=false. MiMo's published Token Plan terms restrict these package keys to programming tools and prohibit custom-backend automated scripts; do not use this profile for company scanning.",
      "probes": [
        {
          "kind": "web_search",
          "status": "failed",
          "checked_at": "2026-09-25",
          "http_status": 400,
          "response_status": null,
          "search_calls": 0,
          "citation_annotations": 0,
          "input_tokens": null,
          "output_tokens": null,
          "total_tokens": null,
          "evidence_path": "docs/implementation/contracts/validation-Q02-MiMo-probe-2026-09-25.log",
          "note": "Provider rejected the requested web_search tool with webSearchEnabled=false; no answer, source, or usage receipt was returned."
        }
      ],
      "documentation": [
        {
          "title": "MiMo web search tool calling",
          "url": "https://mimo.mi.com/docs/zh-CN/quick-start/usage-guide/text-generation/tool-calling/web-search"
        },
        {
          "title": "MiMo Token Plan usage terms",
          "url": "https://mimo.mi.com/docs/tokenplan/subscription"
        }
      ]
    },
    {
      "profile_id": "mimo-pay-as-you-go-cn",
      "provider": "mimo",
      "service_tier": "pay_as_you_go",
      "endpoint": {
        "url": "https://api.xiaomimimo.com/v1/chat/completions",
        "protocol": "openai_chat_completions",
        "region": "China mainland"
      },
      "model": "mimo-v2.6-flash",
      "credential_env": "MIMO_API_KEY",
      "capabilities": {
        "text_generation": "passed",
        "provider_web_search_documentation": "supported",
        "provider_web_search_probe": "passed",
        "function_tool_calling": "not_verified",
        "requires_external_search_runner": false,
        "stockqa_cli_e2e": "not_run"
      },
      "usage_note": "Real web_search returned one tool use, one page, and a Microsoft annual-report citation. A follow-up completed but omitted the requested revenue figure; this is provider capability evidence, not scan-quality or StockQA integration acceptance.",
      "probes": [
        {
          "kind": "web_search",
          "status": "passed",
          "checked_at": "2026-09-25",
          "http_status": 200,
          "response_status": "length_then_stop",
          "search_calls": 1,
          "citation_annotations": 1,
          "input_tokens": null,
          "output_tokens": null,
          "total_tokens": null,
          "source_urls": [
            "https://www.microsoft.com/investor/reports/ar25/index.html"
          ],
          "evidence_path": "docs/implementation/contracts/validation-Q02-MiMo-paygo-probe-2026-09-25.log",
          "note": "First response hit a 220-token cap with no answer text; a follow-up produced text and retained real search evidence, but omitted the requested revenue figure."
        }
      ],
      "documentation": [
        {
          "title": "MiMo web search tool calling",
          "url": "https://mimo.mi.com/docs/zh-CN/quick-start/usage-guide/text-generation/tool-calling/web-search"
        },
        {
          "title": "MiMo API integration",
          "url": "https://mimo.mi.com/docs/zh-CN/quick-start/faq/api-integration"
        }
      ]
    },
    {
      "profile_id": "minimax-cn-responses",
      "provider": "minimax",
      "service_tier": "mainland_openai_compatible",
      "endpoint": {
        "url": "https://api.minimax.cn/v1/responses",
        "protocol": "openai_responses",
        "region": "China mainland"
      },
      "model": "MiniMax-M3.1-Flash",
      "credential_env": "MINIMAX_API_KEY",
      "capabilities": {
        "text_generation": "passed",
        "provider_web_search_documentation": "not_documented",
        "provider_web_search_probe": "not_demonstrated",
        "function_tool_calling": "not_verified",
        "requires_external_search_runner": true,
        "stockqa_cli_e2e": "not_run"
      },
      "usage_note": "This route returned text but no web_search_call or citation annotation. The model mentioning a URL is not evidence that a search ran.",
      "probes": [
        {
          "kind": "text_generation",
          "status": "passed",
          "checked_at": "2026-09-25",
          "http_status": 200,
          "response_status": "completed",
          "search_calls": 0,
          "citation_annotations": 0,
          "input_tokens": 796,
          "output_tokens": 199,
          "total_tokens": 995,
          "evidence_path": "docs/implementation/contracts/validation-Q02-MiniMax-probe-2026-09-25.log",
          "note": "Completed text response; no search event or citation receipt."
        }
      ],
      "documentation": [
        {
          "title": "MiniMax text generation",
          "url": "https://platform.minimax.cn/docs/guides/text-generation"
        }
      ]
    },
    {
      "profile_id": "minimax-global-server-tools",
      "provider": "minimax",
      "service_tier": "international_server_tools",
      "endpoint": {
        "url": "https://api.minimax.io/v1/responses",
        "protocol": "openai_responses",
        "region": "International"
      },
      "model": "MiniMax-M3.1-Flash",
      "credential_env": "MINIMAX_API_KEY",
      "capabilities": {
        "text_generation": "not_verified",
        "provider_web_search_documentation": "supported",
        "provider_web_search_probe": "credential_rejected",
        "function_tool_calling": "not_verified",
        "requires_external_search_runner": false,
        "stockqa_cli_e2e": "not_run"
      },
      "usage_note": "Official Server Tools documentation describes web_search on this endpoint, but the current environment credential was rejected with HTTP 401 / error 2049. A region mismatch is plausible, not proven.",
      "probes": [
        {
          "kind": "web_search",
          "status": "failed",
          "checked_at": "2026-09-25",
          "http_status": 401,
          "response_status": null,
          "search_calls": 0,
          "citation_annotations": 0,
          "input_tokens": null,
          "output_tokens": null,
          "total_tokens": null,
          "evidence_path": "docs/implementation/contracts/validation-Q02-MiniMax-probe-2026-09-25.log",
          "note": "Error 2049: invalid api key for this host; no response or usage receipt."
        }
      ],
      "documentation": [
        {
          "title": "MiniMax Server Tools",
          "url": "https://platform.minimax.io/docs/guides/server-tools"
        }
      ]
    },
    {
      "profile_id": "minimax-mainland-responses-search",
      "provider": "minimax",
      "service_tier": "mainland_compatible_responses_search",
      "endpoint": {
        "url": "https://api.minimaxi.com/v1/responses",
        "protocol": "openai_responses",
        "region": "China mainland compatible host"
      },
      "model": "MiniMax-M3.1-Flash",
      "credential_env": "MINIMAX_API_KEY",
      "capabilities": {
        "text_generation": "passed",
        "provider_web_search_documentation": "not_documented",
        "provider_web_search_probe": "passed",
        "function_tool_calling": "not_verified",
        "requires_external_search_runner": false,
        "stockqa_cli_e2e": "passed_prior_revision_latest_unverified",
        "stockqa_cli_e2e_evidence_path": "docs/implementation/contracts/validation-Q02-MiniMax-cli-live-2026-09-26.json",
        "stockqa_cli_e2e_latest_evidence_path": "docs/implementation/contracts/validation-Q02-MiniMax-final-live-2026-09-26.json"
      },
      "usage_note": "A direct live probe returned one completed web_search_call and Microsoft investor-relations sources. A single-question StockQA public CLI live test passed on an earlier revision after its prompt explicitly required the official annual report; the latest code received HTTP 200/completed but search_status=unverified and correctly failed closed. The host is not named in the official docs checked; availability and contractual status remain unverified. Q02 durable recovery is still open.",
      "probes": [
        {
          "kind": "web_search",
          "status": "passed",
          "checked_at": "2026-09-25",
          "http_status": 200,
          "response_status": "completed",
          "search_calls": 1,
          "citation_annotations": 1,
          "input_tokens": 9739,
          "output_tokens": 263,
          "total_tokens": 10002,
          "source_urls": [